{
  "hook_event_name": "SessionStart",
  "cwd": "/home/user/project",
  "model": "gpt-5.5",
  "permission_mode": "default",
  "session_id": "019f0000-aaaa-7000-8000-000000000001",
  "source": "startup",
  "transcript_path": "/home/user/.codex/sessions/2026/07/17/rollout-2026-07-17T00-00-00-019f0000.jsonl"
}
